<!ELEMENT eurovision (artista*, edicion*)>
<!ELEMENT artista (nombre, descripcion?, url-img?)>
<!ELEMENT nombre EMPTY>
<!ELEMENT descripcion EMPTY>
<!ELEMENT url-img (#PCDATA)>
<!ELEMENT edicion (anno, ciudad, pais, interpretes-paises)>
<!ELEMENT anno EMPTY>
<!ELEMENT ciudad EMPTY>
<!ELEMENT pais EMPTY>
<!ELEMENT interpretes-paises (interprete-pais)*>
<!ELEMENT interprete-pais (voto)*>
<!ELEMENT voto EMPTY>
<!ATTLIST artista cod-artista ID #REQUIRED>
<!ATTLIST nombre text CDATA #REQUIRED>
<!ATTLIST descripcion text CDATA #REQUIRED>
<!ATTLIST anno text CDATA #REQUIRED>
<!ATTLIST ciudad text CDATA #REQUIRED>
<!ATTLIST pais text CDATA #REQUIRED>
<!ATTLIST interprete-pais artista IDREF #REQUIRED>
<!ATTLIST interprete-pais pais CDATA #REQUIRED>
<!ATTLIST interprete-pais cancion CDATA #REQUIRED>
<!ATTLIST interprete-pais orden CDATA #REQUIRED>
<!ATTLIST voto receptor CDATA #REQUIRED>
<!ATTLIST voto nota CDATA #REQUIRED>